Recipe ID,Recipe Name,Recipe Information,ingredients,Image URL,,
503,Buckwheat Crepes Stuffed With Spinach And Eggs Recipe,"To begin making Buckwheat Crepes Stuffed With Spinach And Eggs, first make the crepe batter.For this, whisk together the eggs and milk (under “For the buckwheat crepes”) in a mixing bowl.Add to it, the melted ghee (or butter) and grated nutmeg, stir in the buckwheat flour, salt and mix gently, but thoroughly, till there are no lumps.Set the mixture aside for 15-20 minutes.To make the filling place a pan or wok on the heat, and add some oil to it.
When it is warm, add the onion, ginger-garlic paste and green chilies and saute together for 1-2 minutes till the onion is translucent.Add the chopped spinach leaves next and toss.Sprinkle salt and cook for 1-2 minutes till the leaves wilt.Next, pour in the whisked eggs and stir vigorously to scramble the eggs.Cook for 1-2 minutes till the eggs are still soft and moist, but cooked through.Sprinkle the coriander leaves (or any other herb of choice) and turn the heat off.
Set the filling aside while you proceed to make the crepes.To make the buckwheat crepes place a large flat non-stick/griddle/crepe pan on the heat.
Smear some ghee or butter evenly over it.Pour a ladle full of the batter on the pan and immediately tilt the pan in a circular fashion to spread the batter evenly into a thin pancake.Cook until the bottom is lightly browned, usually about 30-40 seconds.Flip the crepe to cook on the other side for a few seconds.
When full cooked, lay the crepe on a serving dish using a flat spatula.Spoon over the filling on half the crepe or a quarter of the crepe.
Fold over the other side.
Serve the Buckwheat Crepes Stuffed With Spinach And Eggs along with Chickoo Banana Date Smoothie for breakfast."," spinach bunch, milk, onion, buckwheat flour ,eggs, butter",https://www.archanaskitchen.com/images/archanaskitchen/1-Author/Madhuli_Ajay/Buckwheat_Crepes_stuffed_with_Spinach_and_Eggs.jpg,,
504,Rosemary Chicken Rice Recipe With Spicy Tomato Garlic Sauce,"To begin making the Rosemary Chicken Rice Recipe With Spicy Tomato Garlic Sauce we will first make the rice.
Heat olive oil in a pressure cooker, add the garlic and fry until light brown in colour, next add onions and saute till transparent.
Once the onions are transparent add salt, rosemary, chicken cubes, carrot, washed and drained rice and 2 cups of water.
Pressure cook for 3 whistles and turn off the heat.Allow the pressure to release naturally.
Once the pressure has released, open the cooker and fluff the rice with a fork.
To make the Spicy Tomato Garlic Sauce In a skillet heat oil, add the garlic and saute till they turns deep golden brown in colour.
Once done add the basil leaves, and tomato puree and simmer for a few minutes.
Add salt to taste, sugar, tabasco sauce and paprika powder.
Bring to a brisk boil.
Now reduce the heat, stir in the cream and bring to a single boil.
Turn off the heat after a boil.Serve the Rosemary Chicken Rice Recipe With Spicy Tomato Garlic Sauce with a garnish of fresh basil leaves and fried garlic.
Serve Rosemary Chicken Rice Recipe With Spicy Tomato Garlic Sauce as a meal by itself along with a drink of Apple And Ginger Cocktail Recipe followed by a dessert of Greek Yogurt Chocolate Mousse Recipe.
","tomato, rosemary, rice, tabasco sauce, paprika , carrot, onion, chicken",https://www.archanaskitchen.com/images/archanaskitchen/1-Author/sneha-archanaskitchen.com/Rosemary_Chicken_Rice_Recipe_With_Spicy_Tomato_Garlic_Sauce_Recipe-4-2.jpg,,
505,Elaneer Rasam Recipe - Tender Coconut Rasam,"To begin making the Elaneer Rasam Recipe, open a fresh tender coconut, keep the water aside and transfer the tender coconut cream into a bowl.
In a mixer-jar, blend tomato, tamarind and 2 tablespoons of coconut cream by adding water  Reserve the balance tender coconut cream for later.
Add the tomato-coconut-tamarind juice, turmeric, asafoetida, and curry leaves in a Saucepan and bring it to boil.
Stir occasionally.Once the mixture starts boiling, add the rasam powder, and mix well.
Wait until frothy.Add the tender coconut water and boil again.
Boil for just a minute and switch off the gas immediately.Heat a a tadka pan with ghee on low flame, once hot, add the mustard seeds and cumin seeds, keep it going till the mustard seeds splutter.
Turn off the eheat transfer it to the boiling rasam.
Garnish with chopped coriander leaves, and remaining tender coconut cream.
Serve Elaneer Rasam Recipe (Tender Coconut Rasam) with hot steaming rice and papadum or just as a hot piping soup.
","tomato, tender coconut water, coconut pulp, rasam ,mint leaves, tamarind",https://www.archanaskitchen.com/images/archanaskitchen/1-Author/Neeru_Srikanth/Elaneer_Rasam_Tender_Coconut_Rasam.jpg,,
506,Green Beans Fry Recipe,"To prepare Green Beans Fry Recipe, clean the beans and chop them finely.
Heat oil in a heavy bottomed pan and add hing and cumin seeds.
Sauté it for 15 to 20 seconds.After 15 to 20 seconds, add green chillies and beans.Add salt and turmeric powder and let it cook for 3 to 5 minutes.After 3 to 5 minutes, add in the red chilli powder and coriander powder.Cover the lid and cook it till the beans becomes soft and cooked.Keep stirring in between so that the beans don't get burned.Once done, switch off the stove and the Green Beans Fry Recipe is ready to serve with boiled/steamed rice and Mixed Vegetable Sambar to make a wholesome meal.
",green beans ,https://www.archanaskitchen.com/images/archanaskitchen/1-Author/Pooja_Thakur/Green_Beans_Fry.jpg,,
507,Palak Baingan Ki Sabzi - Recipe in Hindi,"To make spinach eggplant vegetable, first heat oil in a pan.
Add the spinach, some salt and cook till the spinach becomes soft.
After cooking, turn off the gas and keep it aside.
Now put some more oil in the same pan.
Add cumin and curry leaves to it.
Allow to cook for 15 seconds.
After that add ginger, garlic, brinjal, salt.
Mix, cover the pan and cook until the eggplants become soft.
Bitch kept moving between bitches.
After the eggplant becomes soft, add asafetida, coriander powder, red chili powder and let it cook for 2 minutes.
Now add cooked spinach and mix.
Allow to cook and serve for 30 seconds.
Serve the Palak brinjal with Gujarati kadhi and fenugreek thepla for dinner.","brinjal, spinach",https://www.archanaskitchen.com/images/archanaskitchen/Indian_Vegetables_Dry/Baingan_Palak_Sabzi_Eggplant_Spinach_Curry_Recipe-1.jpg,,
508,Karwar Style Muga Ambat Recipe (Moong Sprouts in Coconut Curry),"To prepare Karwar Style Muga Ambat Recipe (Moong Sprouts in Coconut Curry), remove the skin of the green gram/moong sprouts by soaking them in water for 20 minutes and then rubbing off with hands.One the moong sprouts are ready, heat a kadai/wok with oil and temper with mustard and curry leaves.Add the onions, sugar and a pinch of salt and keep stirring over low heat till the onions turn brown.Now add the sprouted green gram, tamarind pulp, turmeric powder and mix well and cook them covered over low flame for 5 minutes.Open the lid and add 1 cup of water to the mixture.In a mixer grinder, combine the coconut along with the coriander seeds, salt and red chillies and grind  this along with some water to make a thick coconut paste.
Adjust salt and stir in the thick coconut paste into the curry.
Mix Muga Ambat well and allow them to cook for another 3-4 minutes and switch off.Serve Karwar Style Muga Ambat (Moong Sprouts in Coconut Curry) with Steamed rice or poori and poriyal to enjoy your everyday meal.
","coconut,  green moong sprouts, tamarind paste",https://www.archanaskitchen.com/images/archanaskitchen/0-Archanas-Kitchen-Recipes/2017/4-may/Karwar_Style_Muga_Ambat_Recipe_green_moong_lentil_coocnut_curry-1.jpg,,
509,Spinach Lemon Spaghetti Recipe,"To begin making the Spinach Lemon Spaghetti recipe, prep all the ingredients.
Blanch the spinach, boil and shred the chicken breast.
You can shred the chicken into small pieces using your hands if you are not able to do so by a knife.Now cook the spaghetti al dente as per the instructions given on the packet.
Keep it aside.Heat up a flat plan or skillet.
Add butter into the pan and once it gets melted, add olive oil into it.
Mix it well.Now add chicken pieces and half minced garlic into the pan.
Let it cook and also add paprika powder, salt and some crushed red pepper into the pan.
Mix it well and keep cooking till the chicken looks ready and keep it aside.Turn the heat on and add rest of the minced garlic,chopped tomatoes and spinach into a pan.Cook till the time, the tomatoes become tender and slightly mushy.
Now add spaghetti into the pan and you can add some more butter to it.
In the next step we add the lemon juice, salt, some more chilli flakes into the pan and mix everything.Add the chicken & cook on medium heat for few minutes.
Serve it hot and sprinkle some grated cheese on the top.
You can use any cheese (mozzarella, parmesan, processed) as per your liking.Serve Spinach Lemon Spaghetti along with Pizza Margherita and a glass of wine for your weekend night dinner.
","spinach, paprika , pasta, tomato , chicken",https://www.archanaskitchen.com/images/archanaskitchen/1-Author/garimasgautam-gmail.com/Spinch_Lemon_Spaghetti.jpg,,
510,Nepali Aloo Tareko Recipe,"To begin making Nepali Aloo Tareko Recipe, peel, wash and cut the potatoes into thick wedges, soak it into water to avoid discolouration and keep aside.Heat 2 tablespoons of mustard oil in a pan on high heat so that it reaches its smoking point.Lower the heat, add the fenugreek, caraway seeds and dried red chillies and let it splutter.Add the drained potato wedges, turmeric powder, salt and give it a good stir.Cook the potatoes over high flame so that they get roasted and then simmer till the potatoes are cooked to 3/4.
this will take around 10 minutes.Remove the potatoes into a plate and keep aside.Into the same pan, add a tablespoon of mustard oil and smoke it.Add the ginger and garlic pastes and saute till the raw smell goes away.Add the coriander, red chilli and timur powder and saute well.Re-introduce the potatoes into the pan and stir well until the potatoes are well coated with the spices.Cook the potatoes in low heat for 10 minutes till they are fully done and turns crispy, occasionally stirring inbetween.Switch off the flame and serve the Nepali Aloo Tareko Recipe along hot Steamed Rice and Dal Fry for a comforting weeknight dinner.
", potato ,https://www.archanaskitchen.com/images/archanaskitchen/1-Author/nithya.anantham/Nepali_Aloo_Tareko_Recipe.jpg,,
511,Mangalore Style Southe Gatti/Southekayi kadubu Recipe (Steamed Cucumber Dumplings),"To begin making the Mangalore Style Southe Gatti, we will wash the rice thoroughly with water and place them spread over a table cloth so that it dries away faster.Grind it in a mixer to a smooth powder, keep it aside add coconut and grind that also to a coarse mixture.Mix all the rest of the ingredients into a bowl and you will have a consistency of a dropping batter.Heat a vegetable steamer, if you are using a banana leaf cut them into rectangular shape and place the batter in the center and fold it tightly and carefully place it inside the steamer.
You can as well use a parchment paper.Steam them for at least 15 minutes and serve hot.
Serve the Mangalore Style Southe Gatti along with coconut chutney, tomato onion chutney to enjoy the breakfast.
","coconut, idli rice , cucumber",https://www.archanaskitchen.com/images/archanaskitchen/1-Author/sibyl_sunitha/Mangalore_Style_Southe_GattiSouthekayi_kadubu_Recipe_Steamed_Cucumber_Dumplings.jpg,,
512,Kashmiri Style Shami Mutsch Recipe - Minced Lamb Cutlets In Yogurt Gravy,"To begin making Kashmiri Shami Mutsch Recipe, mince the mutton either with a grinding stone (ammikallu) or in a food processor.In a large mixing bowl, add all ingredients for marination-chilli powder, fennel powder, ginger powder, garlic, corn flour and salt with a tablespoon oil and using your hands mix it properly.
Add minced meat and keep aside for 2 hours to marinate.After 2 hours shape meat mince into oblong cutlets by tightly packing them and arranging them on a plate.
This step is important since the kebab or matsch has to get cooked in yogurt gravy directly after marination and the kebabs need to be firm.Once the meat is marinated and shaped, prepare the gravy now.
To make the gravy, firstly, In a small bowl, add turmeric powder, red chilli powder, fennel powder, ginger powder, coriander powder, salt and add warm water to make a smooth paste.Also, beat the yogurt to make it runny and break yogurt lumps and keep ready.Heat oil in a wide bottomed kadai.
Once the oil is hot, add bay leaves, dry red chilies and whole garam masala.
fry for a few seconds till fragrant.Once you get a nice smell from the tadka, add the spice paste to the kadai and saute till the raw smell disappears.Add yogurt into the masala cooking in the kadai.Keep stirring till the masalas blend in the yogurt and the gravy is formed.
(This gravy will be thinner when compared to ground masala gravy with onions and tomatoes)Add about 2 cups of boiling water and let it boil.
After it comes to the boiling point, add shaped cutlets very carefully, and let it cook for about 10 minutes without disturbing, so that the kebabs get firm.After about 10 minutes of cooking on medium-low flame, stir slowly occasionally.
Cover and cook for another 45- 50 minutes or till the mutton is cooked.Once when the gravy and meat is cooked, check for salt and add garam masala, black cardamom and 1 pinch of sugar.
Stir it carefully well and switch off heat.Serve Kashmiri Shami Mutsch Recipe with steamed rice or Jeera Rice (Pulao) Recipe and Whole Wheat Lachha Paratha Recipe along with Boondi Raita Recipe Spiced With Black Salt.
"," corn flour, curd,  mutton",https://www.archanaskitchen.com/images/archanaskitchen/1-Author/usashis-gmail.com/Kashmiri_Mutsch_ShyamiMinced_lamb_cutlets_in_yogurt.jpg,,
513,Dhaba Mutton Recipe-Spicy Mutton Gravy,"To begin making the Dhaba Mutton Recipe, marinate lamb with yogurt, red chilli powder, turmeric powder, cumin powder, coriander powder, and saltMix everything well and keep it aside for about 2 hours.Heat oil in a heavy bottomed pan and add cloves, cardamoms, bay leaves, garlic, ginger and saute for a few seconds.Add chopped onion, green chillies and saute them till they turn golden brown.Add in the marinated lamb and cook it till the lamb is cooked and tender.Once it is done, add in the tomatoes and green chillies.
Cook it for about 15 to 20 minutes.After 15 to 20 minutes, add in the required water and let it cook for 5 minutes more.Sprinkle garam masala and cook for another 3-4 minutes.
Once it is done, switch off the stove and garnish it with chopped coriander leaves.Serve Dhaba Mutton with Rajasthani baati, steamed rice, Rumali roti or whole wheat lachha paratha.
","tomato, curd, onion, mutton",https://www.archanaskitchen.com/images/archanaskitchen/1-Author/Pooja_Thakur/Dabha_mutton.jpg,,
514,Bendekayi Puli Koddel Recipe - Lady Finger In Coconut Tamarind Curry,"To begin making the Bendekayi Puli Koddel Recipe, into a preheated pan, add oil and okra or Bendekayi.
Sprinkle salt to taste and stir well.
Cover and cook the okras till soft and roasted.
Stir occasionally to ensure even cooking of the Okra.Now we will roast the masalas for the Bendekayi Puli Koddel.Into a preheated pan, add fenugreek seeds, cumin seeds, coriander seeds, sesame seeds, rice grains, dry red chillies, garlic and stir for 3 to 4 minutes until well roasted.Once done, add the coconut and roast for another 2 minutes.
Turn off the heat after the coconut is light golden in color and allow it to cool.
Once the coconut cools down, add the roasted masala to a mixer grinder along with tamarind, jaggery, water and blend to make a smooth paste and keep it aside.Add the ground masala into the pan with the roasted lady's finger.
Add about 1/2 cup of water, salt to taste and bring the Bendekayi Puli Koddel to a brisk boil.
Boil for 4 to 5 minutes until the curry has thickened and reached the desired consistency.
Once done, switch off the gas.*For the seasoning:Heat oil in a tadka pan.
Add mustard seeds and allow it to crackle.
Once the mustard seeds have crackled, add asafoetida, dry red chillies and curry leaves.
Turn off the heat after few seconds and pour the seasoning over the Bendekayi Puli Koddel.
Give it a mix.Transfer the Bendekayi Puli Koddel into a serving bowl and serve.Serve the Bendekayi Puli Koddel Recipe along with Steamed Rice, Mangalorean Padengi Gassi and Elai Vadam for a comforting lunch.
","rice, coconut, tamarind water,  bhindi , sesame seeds",https://www.archanaskitchen.com/images/archanaskitchen/0-Archanas-Kitchen-Recipes/2019/Bendekayi_Puli_Koddel_-_Ladys_Finger_In_Coconut_Tamarind_Curry_8_1600.jpg,,
515,Eggless Whole Wheat Pineapple Muffins Recipe,"To begin making the Eggless Whole Wheat Pineapple Muffins Recipe, Preheat oven to 180°C.
Line the muffin tin with paper liners and brush with oil.Sift together wheat flour and baking powder and keep aside.In a large bowl, take yogurt and add sugar, oil, vanilla essence and 1/2 cup of pineapple juice.
Mix together without lumps.
Gradually add the flour, the chopped pineapple and beat well until just about combined.
Spoon the pineapple muffin cake batter into the cavities.
Bake the Whole Wheat Eggless Pineapple Muffins for about 15 minutes at 180° C until the top turns brown and the muffins are done.
Insert a tester like toothpick in the center and it should come out clean.Once done, remove the eggless pineapple muffins from the oven and allow it to cool.Serve the Eggless Whole Wheat Pineapple Muffins as a tea time snack along with Grilled Cheese Sandwich Made With Paneer & Potato and a cup of coffee for a delicious snack.
","pineapple, wheat flour wheat flour, curd, vanilla, pineapple juice",https://www.archanaskitchen.com/images/archanaskitchen/Dessert_Cakes/Whole_Wheat_Eggless_Pineapple_Muffins_Recipe-1-2.jpg,,
516,Vegan Cucumber Semolina Cake Recipe,"To begin making Cucumber Semolina Cake Recipe, get all the ingredients ready and grate the cucumbers.Heat ghee in a kadai, once the pan is heated, add semolina to it and mix well.
Switch off heat and set it aside for half an hour.After half an hour, add grated cucumber, sugar, cardamom powder, saffron strands, coconut milk, and 3 tablespoons almonds (powdered) - together to the kadai and cook on a high flame.Keep stirring continuously to avoid charring.
Keep folding and stirring till it becomes very thick but spreadable like halwa.Meanwhile, also grease a square cake pan.
And preheat oven at 350 degree F for 8-10 minutes.Pour the cucumber semolina cake mixture in the greased pan and tap for it to settle.Bake the cake mixture for 20-25 min till the cake browns on the top.Remove, allow to cool and when it is warm, slice it into desired shape.
Demould and serve chilled.Serve Cucumber Semolina Cake Recipe as dessert after a meal of Mutton Rezala Recipe and Whole Wheat Lachha Paratha Recipe (Multilayered Layered Indian Flat Bread).
","coconut milk, saffron strands, cucumbers ,sooji ",https://www.archanaskitchen.com/images/archanaskitchen/1-Author/Sadaf_Abbasi/cucumber_semolina_cake.JPG,,
517,Cashmere Steel Fried Tomato Recipe - Fish Curry,"To begin making the Gaad T Tamatar, wash fish nicely, pat dry the fillets and rub lemon juice, turmeric and salt.
Leave the fillets in the colander for 10-15 mins to drain out excess water and odour.Collect the fillets in a bowl and keep aside.
Heat around one ladle oil till smoking hot in a wok/kadai and carefully slide the fish fillets in it.Fry the fish from both sides till golden in colour.
Collect the fried fish in a separate plate and keep aside.In the remaining oil, add cloves, black cardamom and asafoetida and wait till they sizzle.Now add the tomato puree along with dry ginger powder, fennel powder and red chilli powder.
Mix and fry till oil starts leaving from sides.Now add some garam masala and adjust salt as needed.Add water to make a thick curry and slide the fried fish in the curry.Give a boil and then simmer the flames, cover the lid and cook for 5 minutes.Turn off the heat, garnish with some fresh coriander and serve hot.
Serve Gaad T Tamatar along with Steamed Rice for a weekday kashmiri lunch or dinner.
You can also serve it to your guests in your house parties.
","tomato, fish ",https://www.archanaskitchen.com/images/archanaskitchen/1-Author/Shaheen_Ali/GAAD_T_TAMATAR__KASHMIRI_FISH_CURRY.jpg,,
518,Peanut Butter Oat Almond Energy Bar Recipe,"To begin making the Peanut Butter Oat Almond Energy Bar Recipe, firstly we will combine all the ingredients in a food processor jar.
In a mixer jar, add the dates, peanut butter, chocolate chips, oats, vanilla extract and the NutriChoice Oats Almonds & Chocolate Cookies, blend until well combined.
Transfer the energy bar mixture onto a tray, spread evenly and pat it tightly until firm.
Refrigerate for 2 hours.
Take them out and cut according your desired shapes and serve.Serve the Peanut Butter Oat Almond Energy Bar Recipe as a healthy after school snack along with a glass of Apple, Kiwi, Pineapple Juice Recipe.
","peanut butter, dates,oats, vanilla, oat , chocolate chips",https://www.archanaskitchen.com/images/archanaskitchen/1-Author/sibyl_sunitha/Peanut_Butter_Oats_Almond_Date_Bar_Recipe_31_1600.jpg,,
519,Whole Wheat Cupcakes Recipe,"To prepare Whole wheat cupcake recipe, preheat the Oven to 180 degrees Celsius.Mix flour, baking soda and baking powder in a bowl and whisk well.Add eggs, butter, and sugar in a separate bowl and beat well till the mixture is light.Fold the flour into the above mixture.Add the buttermilk and vanilla essence and mix well.Transfer the cake batter into cupcake moulds with liners in them.Bake in the oven for 15-20 minutes or until ready.Top the whole wheat cupcakes with chocolate ganache and serve during tea time.
","wheat flour, chocolate ganache, vanilla, buttermilk, eggs",https://www.archanaskitchen.com/images/archanaskitchen/1-Author/Asha_Venugopal_/Wholewheat_Cupcakes.jpg,,
520,Spirulina Protein Energy Balls with Ragi Recipe,"To begin making the Spirulina Protein Energy Balls with Ragi Recipe, add all the nuts first in a food processor and blitz till it forms a coarse powder.Remove the powdered nuts and add the dates and apricots and blitz them as well till them become coarse paste.Add the powdered nuts, flax seed powder, ragi powder, peanut butter, spirulina, peanut butter and oil and blitz all of them together till they combine.Take out the mixture and start shaping them into small medium sized balls and refrigerate for later use.
Serve the Spirulina Protein Energy Balls as a snack with or a healthy dessert after your morning breakfast with Oats, Mango and Yogurt Breakfast Parfait for a satisfying meal.
","butter, apricots dried, pistachios, ragi flour, spirulina, , dates",https://www.archanaskitchen.com/images/archanaskitchen/1-Author/sibyl_sunitha/Spirulina_Protein_Energy_Balls_with_Ragi_Recipe.jpg,,
521,Ammini Kozhukattai Recipe,"To begin with Ammani Kozhukattai, Soak rice for 3 to 4 hours in water.After 3-4 hours, grind to smooth paste with salt.Heat a teaspoon of coconut oil in a deep non-stick pan and add the rice paste.Keep stirring until the mixture turns transparent & rolls into a ball, allow this to cool.Add turmeric powder and hing to this rice dough and mash nicely with hands.Make into tiny balls and arrange in idli plate.
Steam cook until the idli cooker whistles.Heat oil in a tadka pan and add all the ingredients under ‘For tempering’.
Once the mustard seeds splutter, pour it on the steamed balls.Serve Ammani Kozhukattai with South Indian Coconut Chutney and Masala chai.
","rice, sambar ",https://www.archanaskitchen.com/images/archanaskitchen/1-Author/Sowpernica/Ammani_Kozhukkattai.jpg,,
522,Sindhi Tidali Dal Recipe,"To begin making the Sindhi Tidali Dal Recipe,  wash the chana dal, split green moong dal and urad dal a couple of times and soak them together in a bowl for about 2 hours.
In a pressure cooker, add the soaked and drained dals, salt to taste, turmeric powder, green chilli, tomatoes, and ginger.
Add about 3 cups of water and pressure cook for 4 whistles, and turn off the heat.
Allow the pressure to release naturally, then open the lid of the pressure cooker and lightly mash the dals.To make the tadka for the Tidali Dal Heat a tadka pan with ghee on medium heat.
Once the ghee is hot, add in the cumin seeds and asafoetida, allow it to sizzle.
Once the cumin seeds have crackled add the garlic and continue to cook until it turns into a deep brown colour.
Once we have achieved the deep brown colour of the garlic, turn off the heat and add red chilli powder and mix well.
Pour this tadka over the cooked tidali dal along with the coriander leaves and mix well.
Transfer the Sindhi Tidali Dal into a serving bowl and serve hot.Serve Sindhi Tidali Dal Recipe along with Phulka, Sindhi Karela Jo Bhaji Recipe - Sindhi Style Bitter Gourd Sabzi, and Pickled Onions for a simple weekday lunch.
 ","tomato,urad dal , moong dal , chana dal ",https://www.archanaskitchen.com/images/archanaskitchen/0-Archanas-Kitchen-Recipes/Articles/Sindhi_Tidali_Dal_Recipe_1_1600.jpg,,
