Recipe ID,Recipe Name,Recipe Information,ingredients,Image URL,,
0,Masala Karela Recipe,"To begin making the Masala Karela Recipe,de-seed the karela and slice.
Do not remove the skin as the skin has all the nutrients.
Add the karela to the pressure cooker with 3 tablespoon of water, salt and turmeric powder and pressure cook for three whistles.
Release the pressure immediately and open the lids.
Keep aside.Heat oil in a heavy bottomed pan or a kadhai.
Add cumin seeds and let it sizzle.Once the cumin seeds have sizzled, add onions and saute them till it turns golden brown in color.Add the karela, red chilli powder, amchur powder, coriander powder and besan.
Stir to combine the masalas into the karela.Drizzle a little extra oil on the top and mix again.
Cover the pan and simmer Masala Karela stirring occasionally until everything comes together well.
Turn off the heat.Transfer Masala Karela into a serving bowl and serve.Serve Masala Karela along with Panchmel Dal and Phulka for a weekday meal with your family.
","amchur , karela , gram flour , onion",https://www.archanaskitchen.com/images/archanaskitchen/1-Author/Pooja_Thakur/Karela_Masala_Recipe-4_1600.jpg,,
1,Spicy Tomato Rice (Recipe),"To make tomato puliogere, first cut the tomatoes.
Now put in a mixer grinder and puree it.
Now heat oil in a pan.
After the oil is hot, add chana dal, urad dal, cashew and let it cook for 10 to 20 seconds.
After 10 to 20 seconds, add cumin seeds, mustard seeds, green chillies, dry red chillies and curry leaves.
After 30 seconds, add tomato puree to it and mix.
Add BC Belle Bhat powder, salt and mix it.
Allow to cook for 7 to 8 minutes and then turn off the gas.
Take it out in a bowl, add cooked rice and mix it.
Serve hot.
Serve tomato puliogre with tomato cucumber raita and papad for dinner.","tomato, chickpea lentils, rice, white urad dal",https://www.archanaskitchen.com/images/archanaskitchen/1-Author/b.yojana-gmail.com/Spicy_Thakkali_Rice_Tomato_Pulihora-1_edited.jpg,,
2, Upma Recipe ,"To begin making the Upma  Recipe, first steam the semolina in a rice cooker or a steamer for about 5-6 minutes or till it is cooked but firm.Keep aside this aside till later use.
You can add a few drops of oil and mix it so that they don't stick to each other.Place a kadai on the heat, add the ghee or oil to it and when warm add hing and allow it to sizzle for 30 seconds.
Then follow it up with mustard seeds, urad dal and curry leaves, and allow them to crackle.Saute for 1 minute or so till the urad dal is slightly browned.Then, add onions and fry till translucent and soft.Next, add the green chillies along with par boiled carrots and peas.
Sprinkle some salt and cook for 2-3 minutes or until the vegetables are semi cooked.Then, add the steamed ragi vermicelli toss it together so the vegetables are all well combined.Switch off the heat, take the vermicelli out into a serving dish and to with lemon juice.
Mix well and serve along with Coconut Chutney and a hot cup of coffee or tea for a wholesome breakfast.","semolina, tomato, potato, green peas ,  onion",https://www.archanaskitchen.com/images/archanaskitchen/1-Author/Monika_Manchanda/Ragi_vermicilli.jpg,,
3,Gongura Chicken Curry Recipe - Andhra Style Gongura Chicken,"To begin making Gongura Chicken Curry Recipe first prep all the ingredients and keep them aside.In a small pan, dry roast the methi seeds, coriander seeds, fennel seeds and red chillies for about 3 to 4 minutes on medium heat, until you notice the seeds crackling.
Once done, turn off the heat and allow it to cool a bit and blend it into a smooth powder.Heat oil in a pressure cooker over medium heat; add the chopped onions, ginger, garlic and green chillies and saute until the onions are lightly browned and tender.Add the tomatoes, and saute until the tomatoes become soft and mushy.
Once done add the chicken, the garam masala and turmeric powder.
Add 1/4 cup of water and pressure cook the chicken for 3 to 4 whistles and turn off the heat.Once done, allow the pressure to release naturally.Make sure there are no stems when you pick the gongura leaves.
Wash and chop the gongura leaves and keep aside.In another pan,add some oil along garlic and saute the chopped gongura leaves along with a little salt and the ground masala.
The gongura leaves will wilt almost instantly.
Saute the gongura in the masala for about 3 to 4 minutes until it becomes like a mushy paste.Once done, add the cooked chicken curry into the Gongura masala and saute on high heat for another 2 minutes and turn off the heat.Check the salt and spices and adjust according to taste.
Transfer the Gongura Chicken Curry to a serving bowl and serve hot.Serve Gongura Chicken with Ghee Rice Recipe | Neychoru , Tomato Onion Cucumber Raita Recipe and a Semiya Payasam for a delicious weekend lunch.","tomato, sorrel leaves , fennel seeds , cloves garlic, onion, chicken,  ",https://www.archanaskitchen.com/images/archanaskitchen/Ghongura_Chicken_Curry_Recipe-2_1600.jpg,,
4,Andhra Style Alam Pachadi Recipe - Adrak Chutney (Recipe),"To make Andhra Style Alam Pachadi, first heat oil in a pan.
Add lentils and cook till it turns brown.
Now add dry red chillies, coriander seeds, onion, ginger and cook till the onion becomes soft.
After the onion is cooked, add tomatoes and cook till the tomatoes become soft.
Turn off the gas and allow it to cool.
After it cools down, put it in a mixer grinder and make a paste.
For tempering, heat the oil in a small pan.
Add mustard seeds and let it cook for 10 seconds.
Now add curry leaves, asafoetida and let it cook for 10 seconds.
Add it to the chutney and mix.
Serve Andhra Style Alam Pachadi with Ghee Roast Dosa and Kirai Sambar for breakfast.","tomato, curry, chana dal, onion, white urad dal",https://www.archanaskitchen.com/images/archanaskitchen/1-Author/sibyl_sunitha/Andhra_Style_Allam_Pachadi_Ginger_Chutney_Recipe_.jpg,,
5,Pudina Khara Pongal Recipe (Rice and Lentils Cooked With Mint Leaves & Mild Spices),"To begin making Pudina Khara Pongal Recipe, wash and soak the rice and dal for 20 minutes.Make a paste of mint/pudina, coriander, green chilli and ginger using a mixer grinder and keep aside.Now, heat oil in the pressure cooker, add the cumin seeds and let it crackle.Add the soaked rice and dal and fry for a few minutes.Add the mint coriander paste and saute for a minute.Add 5 cups of water, season with salt and pressure cook for 4 to 5 whistles and keep aside.In the mean prepare the tadka by heating ghee in a small tadka pan.Add in the cumin seeds, peppercorns and let it crackle.Add the cashew halves and fry till they turn golden.Add the curry leaves and asafoetida and turn off the flame.Once the pressure has been released, open the lid and mash the pongal mixture.Add in the tadka over it and Serve the Pudina Khara Pongal Recipe along with Kathirikai Gothsu Recipe (Spicy and Tangy Eggplant Curry)and South Indian Coconut Chutney for a relaxed weekend breakfast.","  moong dal , rice, ",https://www.archanaskitchen.com/images/archanaskitchen/1-Author/nithya.anantham/Mint_Khara_Pongal_Recipe.jpg,,
6,Udupi Style Ash Gourd Coconut Curry Recipe,"To begin making the Udupi Style Ash Gourd Coconut Curry Recipe  cook the ash gourd in the pressure cooker with little water, turmeric powder and salt for just 1 whistle.
Release the pressure naturally.Soak the tamarind ball in hot water for about 15 minutes, and squeeze and keep the water.Then dry roast the spices and other ingredients for the ground paste in a pan except the coconut.
Then grind it along with coconut to a smooth paste.In same pressure cooker which has the ash gourd add the paste and little water and give it stir.
Keep the Udupi Ash Gourd Coconut Curry on the medium heat, Adjust the seasoning and texture if required.
Once done transfer it in a bowl.For the seasoning, heat oil in a small skillet and add mustard seeds and let it crackle.
After the mustard seeds have crackled add the curry leaves and red chillies.
Tun off the heat after the red chillies have darkened and add it on top of the Udupi Style Ash Gourd Coconut Curry and serve.
Serve the Udupi Style Ash Gourd Coconut Curry Recipe along with steamed rice, Elai Vadam  and Pisarna Manga for lunch.","tamarind water, coconut, vellai poosanikai , sesame seeds ",https://www.archanaskitchen.com/images/archanaskitchen/1-Author/sibyl_sunitha/Udupi_Style_Ash_Gourd_Coconut_Curry_Recipe_.jpg,,
7,Mexican Style Black Bean Burrito Recipe,"To begin making the Black Bean Burrito recipe, pick the coriander leaves and set aside, then finely slice the stalks.Keep it aside.Heat 1 tablespoon of oil in a heavy bottomed pan over a medium heat, add the chopped garlic and coriander stalks and fry till they become brown.Add the cooked beans, mix it well and cook for a minute.
Add the rice and cook for further 5 minutes.
Remove from the heat and add coriander leaves that were kept aside.
For Salsa, toss together tomatoes, onions, spring onions, lime juice, coriander leaves, mix well using a fork and season to taste.Heat the tortillas on a griddle pan till it softens.
Lay it on a plate.Layer spinach leaves over the  tortilla.
Spoon one-quarter of the fried rice and beans, top with a generous spoonful of salsa.Grate over some cheese and add a spoon of yoghurt.
Wrap up the burrito, then tuck it in.Repeat with the remaining ingredients to make the rest of the burritos.
Serve Black Bean Burrito with a side of chips and a healthy Green Apple, Radish & Pepper Salad  and a glass of Carrot Pineapple Orange Juice Recipe to make a delicious lunch or dinner.","tomato, spring onion greens, hung curd , black beans, cloves garlic, rice brown rice, onion, cheddar cheese, spinach leaves ",https://www.archanaskitchen.com/images/archanaskitchen/1-Author/Madhuri_Aggarwal/Black_Bean_Burrito.jpg,,
8,Spicy Crunchy Masala Idli Recipe,"To prepare Spicy Crunchy Masala Idli Recipe, Heat a tablespoon of oil in a heavy bottomed pan and stir fry them until they are lightly crisp.
Transfer to a bowl and keep aside.In 2 teaspoons of oil the same pan; add in the onions, capsicum, green chillies and saute them on medium heat until tender.
This takes about 5 to 7 minutes.
 Add in the chopped tomatoes, salt, pepper, turmeric powder, chilli powder and stir well.
Saute until the tomatoes turn soft.
Finally stir in the tomato ketchup, the fried idli's the chopped coriander and mint leaves.
Stir fry on high heat until well combined just for about a minute.Turn off the heat and transfer the Spicy Crunchy Masala Idli Recipe to a serving bowl and serve hot topped with more date chutney or tomato ketchup.","tomato, idli, tomato ketchup, onion, green bell pepper , mint leaves ",https://www.archanaskitchen.com/images/archanaskitchen/Guest_Writers/Jeny_John/Spicy_Crunchy_Masala_Idli_Recipe.jpg,,
9,Cauliflower Leaves Chutney (Recipe in Hindi),"To make cauliflower leaf chutney, first of all take out the leaf inside the cabbage and wash it well.
Dry and cut it well.
Heat the oil in a pan.
Add urad dal, dry red chilli and cook till the dal turns golden.
Keep it aside.
Add some more oil to the same pan.
Add cabbage leaves, salt and cook till the leaves become soft.
Now add tomatoes, garlic and mix well.
Cook until tomatoes are soft.
After cooking, turn off the gas and allow this mixture to cool.
Pour it into a mixer grinder with the dal mixture and grind it.
Add some water and salt and grind it once more.
For tempering, add mustard seeds to a tempering pan.
After 10 seconds, add cumin, asafoetida and curry leaves.
After 15 seconds, add it to the chutney and mix.
Serve Cabbage Leaves Chutney with Vegetable Sambar and Rice for dinner.","tomato, spoon oil,  cabbage leaves, tamarind, urad dal",https://www.archanaskitchen.com/images/archanaskitchen/1-Author/anu.mallajosyula-gmail.com/Cauliflower_leaf_chutney_recipe_edited_1.jpg,,
10,Homemade Baked Beans Recipe (Wholesome & Healthy),"To begin making the homemade baked beans recipe, we first have to soak the beans overnight for about 8 hours in water.We also have to make the cooked tomato puree.
Click here to see the recipe of how to make tomato puree at home.Once the beans are soaked well, our next step is to cook them.
I like using the pressure cooker method to cook the beans.
Place the beans in the pressure, place the weight on, cover the pan and cook it along with 2-1/2 cups of water.
After you heat 4 to 5 whistles, turn the heat to low and cook for another 15 minutes.Turn off the heat and allow the pressure cooker to release its pressure naturally.
This would take another 10 minutes.
The beans continue to cook under the pressure even when it is turned off.Once the pressure is released, open the cooker and drain out the excess liquids.
You store this liquid and use it in the vegetable stock or risotto.Once the beans are cooked, our next step is to spice it up to make the baked beans.Heat oil in a sauce pan on medium heat; add in the onions and garlic and give it a light sauté until the onions are tender.
Add the tomatoes, honey and the spices and give it a stir.Add in the cooked drained beans into the tomato gravy.
Stir fry the beans until the beans get well coated with the tomatoes.
Cover the pan, turn the heat to low and simmer the beans for about 30 minutes until you noticed the beans are well coated with the spices and tomatoes.
Check the salt and seasoning levels and adjust to suit your taste.You can optionally garnish the Homemade Baked Beans with coriander leaves and serve it along with toast, or Potato Cakes Recipe.","tomato,  pepper ,  virgin olive oil, onion, dry beans ",https://www.archanaskitchen.com/images/archanaskitchen/World_Breakfast/Homemade_baked_beans_Recipe_healthy_breakfast_shutterstock_222439996.jpg,,
11,Veg Chili Cheese Burgers Recipe,"To begin making the Veg Chili Cheese Burgers Recipe, we will first pressure cook the potatoes and keep it ready.
Cook them for 5 whistles in a pressure cooker.
Once done allow the pressure to release naturally and peel off the skin.
Add them into a bowl and mash it using a potato masher.Add onions, salt and red chilli powder and bind it together.
Shape them into medium sized cutlets and leave it in the fridge to rest until you move on to make the sauce.To make the sauce, heat a flat skillet with oil on medium heat, add garlic and allow it soften for few seconds.Add chopped onions and saute until they turn golden brown.
Add chopped capsicum and saute for a few minutes.
Add in chopped tomatoes and sprinkle with a bit of salt and saute till they turn mushy.
Also add in the tomato puree and all the seasonings like, red chilli powder, cumin powder, red chilli flakes, dried oregano, tobacco sauce and honey.Keep sautéing until the tomatoes are cooked, you will notice the tomatoes will change color and the raw smell goes away.At the end add the soya granules and salt to taste.
Add about 1/4 cup of water and allow it to boil for 4-6 minutes minutes.
Let the sauce be little gravish.Switch off the heat, heat a flat skillet for the patties to shallow fry them.
Take the patties out of the fridge.
Beat an egg into a bowl and also keep the bread crumbs ready over a plate.Carefully dip the patties into the egg and place them over the bread crumbs and coat them well on either side Dust off the excess bread crumbs.Place the crumb dipped patties on to the hot skillet and drizzle some oil on top.
Cook on either side for atleast 10 minutes.
Till you can see brown color crispy layer on top.Do the same for the rest of the patties and set aside.Once done, add a tablespoon of butter on the same skillet and cut the burger bun in to half horizontally and toast them on the tawa.
Toast till the burger buns are golden brown and crisp.Take a cooked patty, spoon two tablespoon of the sauce on top, place a cheese slice over it and microwave the patty for just 10 seconds until you see the cheese melt.Take the patty out, spread some of the sauce on the base of the burger bun and place the patty with cheese on top and add few slices of jalapeno and close it with the burger top and serve.
Do the same for the rest of the burger.Serve the Veg Chili Cheese Burgers Recipe along with baby potato stir fry and Mango Iced Tea Recipe to make it a complete meal.","cheese, burger buns, potato  pressure, tomato, soy granules, eggs,  tabasco original sauce,  jalapenos, onion, green bell pepper , wheat bread crumbs",https://www.archanaskitchen.com/images/archanaskitchen/1-Author/sibyl-archanaskitchen.com/Veg_Chili_Cheese_Burgers_Recipe.jpg,,
12,Andhra Steel Ingavu Charu Recipe - Asfoitida Flavored Tamarand Rasam,"To begin making the Andhra Style Ingavu Chaaru Recipe pressure cook the tamarind water with toor dal, hing and salt for about 4 whistles.
Turn off the flame and allow the pressure to release naturally.
Open the lif of the cooker and thoroughly mash the dal and bring the whole mixture together by mixing it well.
To temper, heat a kadai with oil, add mustard seeds, cumin seeds, fenugreek seeds and allow it to crackle.Add curry leaves, pinch of hing and leave it for 2 seconds and pour it over the rasam.
Serve the Andhra Style Ingavu Chaaru Recipe along with steamed rice and Gorikayi Palya Recipe  as a comforting meal during your week day."," toor dal, tamarind water",https://www.archanaskitchen.com/images/archanaskitchen/1-Author/sibyl_sunitha/Andhra_Style_Ingavu_Chaaru_Recipe_Asafetida_flavored_Tamarind_Rasam.jpg,,
13,And fish soup recipe - Bengali style fish in tomato gravy,"To begin making the Aar Macher Jhol Recipe, firstly marinate the fish with salt and turmeric powder.Heat oil in a wok and shallow fry the fish on both sides till they turn crispy and golden.
Remove and keep aside.Into the same wok, add bay leaves and cumin seeds.
Fry these for 1 minute and add the chopped tomatoes.Sauté well.
Into this Bengali Style Fish Gravy, add turmeric powder, cumin powder, coriander powder and enough salt and sauté till tomatoes soften.
Add the ginger paste and coarsely crushed green chilies.
Sauté till raw smell goes away and oil floats.Now add the water and allow the Fish gravy to come to a boil.
Once the gravy starts boiling, add the fried fish and cook covered till fish has cooked through.
[This should take about 6 to 8 minutes approximately]Once the fish has cooked through, add the slit green chilies, adjust salt if necessary and add sugar to taste.
Allow it to cook for 5 minutes.Garnish this Bengali Fish Curry with coriander leaves and serve hot.
Serve piping hot Aar Macher Jhol – Fish In Spicy Tomato Gravy along with Steamed Rice and Begun Bhaja for a weekday lunch or dinner.
Enjoy!","tomato,   mustard oil,  aar maach ",https://www.archanaskitchen.com/images/archanaskitchen/1-Author/donna_george/Aar_Macher_Jhol__Bengali_Style_Fish_In_Spicy_Tomato_Gravy_1600.jpg,,
14,Saunf Aloo (Fennel Potato Curry) Recipe,"To begin with Saunf Aloo, heat oil in a pressure cooker.
Add turmeric powder, salt, red chilli powder and crushed fennel seeds till the fennel seeds turns golden in colour.Now add the potatoes and mix it properly with the masala.
Sauce it for 2-3 minutes and then add enough water to cover the potatoes in the cooker.Switch the heat after two whistles and once the pressure is released, open the lid of the pressure cooker.The next step is to add the cream or milk and mash a few potatoes to get a thicker consistency.
Let it cook for 5 more minutes or until the cooker releases 2 more whistles.Garnish the Saunf Aloo with some roasted saunf and chopped coriander.
Serve Sauf Aloo along with Amritsari Dal and Whole Wheat lachha Paratha for a weekday meal."," potato  skin, milk",https://www.archanaskitchen.com/images/archanaskitchen/1-Author/Madhuri_Aggarwal/Saunf_Aloo__Fennel_Potato_Curry.jpg,,
15,South Indian Onion Chutney Recipe - South Indian Onion Chutney (Recipe),"To make South Indian Onion Chutney, first of all chop the onion and keep it aside.
Now heat 1 teaspoon of oil in the pan.
Add cumin seeds, dry red chillies and let it cook for 10 seconds.
Now add urad dal in it and let it cook till it becomes golden.
Turn off the gas and drain in a bowl.
Add another spoon of oil to the same pan.
Add onions and let it cook for 4 to 5 minutes.
Turn off the gas and let it cool down.
Now put urad dal, cumin and dry red chillies in the mixer grinder and grind them.
Add cooked onions, tamarind and jaggery.
Add some water and grind it.
Now for the tempering, heat the oil in a small pan.
Add mustard seeds and curry leaves.
After 10 seconds, add it to the chutney and mix.
Serve South Indian onion chutney with masala dosa or ghee dosa for a tsunag breakfast.","urad dal , onion, tamarind paste",https://www.archanaskitchen.com/images/archanaskitchen/1-Author/Aparna/The_Healthy_South_Indian_Onion_Chutney_1600.jpg,,
16,Hariyali Egg Curry Recipe In Coriander and Mint Gravy,"To begin making the Hariyali Egg Curry recipe, we will first make the Hariyali Masala.Into the Mixer Grinder (medium jar), add the Coriander leaves mint leaves, Green Chillies and 1/2 cup water.
Blend all of them together to make a smooth paste and keep aside.Into the small jar of the mixer grinder, add the onions, ginger and garlic and grind to make a paste.
Heat 1 tablespoon oil in a kadai over medium heat, add the Bay leaf (tej patta), Cloves, Cinnamon Stick and roast for a few seconds.
Add the Onion ginger garlic paste.Saute for 4 to 5 minutes until raw onion smell goes away.Once the onions are roasted, add garam masala powder, coriander powder and saute for a few seconds.Add the Hariyali Coriander Mint Mixture, the fresh cream and the 4 Boiled eggs.Add water if required to adjust the consistency of the Hariyali Egg Curry.
 Cover & simmer the Hariyali Egg Curry for 5 minutes.Check the salt and spices and adjust to according to your taste and transfer the Hariyali Egg Curry into a serving bowl.
Serve the Hariyali Egg Curry along with Malabar Parotta or  Whole Wheat Lachha Paratha and Burani Raita for a weeknight dinner.","mint leaves ,  onion, eggs, ",https://www.archanaskitchen.com/images/archanaskitchen/0-Archanas-Kitchen-Recipes/Hariyali_Egg_Curry_Recipe_Creamy_Coriander_and_Mint_Curry-5_1600.jpg,,
17,Gourd Raita Recipe - Grated Bottle Gourd Yogurt Salad,"To prepare gourd raita, prepare all the ingredients first.
Add grated gourd, cucumber, curd, green chillies, salt, cumin powder and coriander in a large bowl.
Mix well and your raita is ready.
Serve gourd raita with Garlic Dal, gourd elder greens and phulka for dinner.","cucumber grind, cumin , curd, gourd",https://www.archanaskitchen.com/images/archanaskitchen/Indian_Raitas/Lauki_Raita_Recipe_Grated_Bottle_Gourd_Yogurt_Salad-1.jpg,,
18,Homemade Tater Tots Recipe,"To begin making the Homemade Tater Tots Recipe, scrub potatoes thoroughly and wash them until clean.
Peel the skin of the potatoes and we will not parboil the potatoes in hot water.
In a large saucepan, add the potatoes and boil it brisk for about 5 to 7 minutes.
After 5 to 7 minutes the potatoes would have boiled through slightly, but firm.Once boiled, water the potatoes until cold water and pat dry.
This process will cool the potatoes a little.
Once slightly cooled, grate the potatoes into a large mixing bowl.
Add the garlic powder, onion powder, dried oregano, red chili flakes, fresh coriander leaves, salt to taste, all purpose flour, rice flour and mix well to form a dough like consistency.The next step is to shape the potatoes and deep fry the tater tots.
Grease your fingers and palm with oil and shape the potatoes into bite size ovals (cylinders).Heat oil in a pan for deep frying over medium heat.
Carefully drop each one of the shaped Tater Tots in oil and fry them on medium heat until golden brown on all sides.Once done, remove the Tater Tots from the oil and place it on kitchen paper towels to absorb the excess oil.Serve the Tater Tots with tomato ketchup or a Sichuan Style Bird Eye Chili Sauce as a tea time snack or as an appetizer for parties.","rice flour, onion , flour ,  potato ",https://www.archanaskitchen.com/images/archanaskitchen/1-Author/Jyothi_Rajesh/Homemade_Tater_Tots.jpg,,
19,Chettinad Vegetable Casserole Recipe - Chettinad Vegetable Pulao Recipe,"To make Chettinad vegetable casserole, first cut all the vegetables.
Soak rice for 30 minutes.
Heat a pan on gas.
Add long, cinnamon, fennel, whole black pepper, coriander seeds, and roast for 2 to 3 minutes.
Turn off the gas and allow this spice mixture to cool.
After it cools down, put it in a blender and grind it.
Keep it aside.
Now heat ghee in a pan.
Add ginger, garlic, onion, green chilies and cook till the onion becomes soft.
After the onion becomes soft, add carrots, green beans, potatoes, bay leaves, turmeric powder, red chilli powder, ground spices and mix well.
After 2 minutes, add rice, salt, 2 cups of water and let it boil.
After boiling, reduce the heat, cover the pan and cook until the rice is cooked.
If the rice remains raw, then add some more water and cook it.
After cooking, turn off the gas, cover and keep it aside for 10 minutes.
Serve.
Serve Chettinad Vegetable Casserole Recipe along with Bundi Raita and Baked Papad for dinner.","rice, carrot, green beans, onion, potato, pepper,  green peas",https://www.archanaskitchen.com/images/archanaskitchen/Indian_Rice/Chettinad_Vegetable_Pulao_Recipe_with_Kohinoor_Platinum_Basmati_Rice_-1.jpg,,
