Recipe ID,Recipe Name,Recipe Information,ingredients,Image URL,,
160,Chicken Sausages Recipe,"To begin making the Chicken Sausages, Baked Beans and Stir Fried Broccoli Recipe, we will first make the baked beans.
Soak the beans overnight for about 8 hours in water.We also have to make the cooked tomato puree.
Once the beans are soaked well, our next step is to cook them.
 Place the beans in the pressure, place the weight on, cover the pan and cook it along with 2-1/2 cups of water.
After 4 to 5 whistles, turn the heat to low and cook for another 15 minutes.Turn off the heat and allow the pressure cooker to release its pressure naturally.
This would take another 10 minutes.
The beans continue to cook under the pressure even when it is turned off.Once the pressure is released, open the cooker and drain out the excess liquids.
You store this liquid and use it in the vegetable stock or risotto.Once the beans are cooked, our next step is to spice it up to make the baked beans.Heat oil in a sauce pan on medium heat; add in the onions and garlic and give it a light sauté until the onions are tender.
Add the tomatoes, honey and the spices and give it a stir.Add in the cooked drained beans into the tomato gravy.
Stir fry the beans until the beans get well coated with the tomatoes.
Cover the pan, turn the heat to low and simmer the beans for about 30 minutes until you noticed the beans are well coated with the spices and tomatoes.
Check the salt and seasoning levels and adjust to suit your taste.To Stir fry the BroccoliHeat a sauce pan with oil, add garlic and sauté them till they soften.
Add broccoli and season it well with all the seasonings.Sprinkle little water and cook the broccoli for about 5 more minutes till they become quiet tender.
Check for salt and switch off the heat.To Cook the sausagesBefore you fry the sausages over a pan, make sure the sausages are not frozen and they are thawed well.Prick the sausages with the fork, place a wide pan with 1 inch water and butter.
Bring it to a boil.Once it begins to boil, place the sausages inside.
Keep turning them until all the water is evaporated and till you can deglaze the pan.
Brown the sausages well on all the sides.The sausages will take about 10 minutes to cook and you can serve it over a plate.To plate, place the sausages over the side, add baked beans, place the stir fried broccoli and keep a garlic bread next to it and serve.
Serve the Chicken Sausages, Baked Beans and Stir Fried Broccoli Recipe along with a glass of Cantaloupe Pomegranate and Mint Juice Recipe for your Sunday brunch.","chicken , tomato,  onion,",https://www.archanaskitchen.com/images/archanaskitchen/1-Author/sibyl_sunitha/Chicken_Sausages_Baked_Beans_and_Stir_Fried_Broccoli_Recipe.jpg,,
161,Crispy Chicken Dumplings Recipe,"To begin making the Crispy Chicken Pakoda Recipe, clean and wash chicken pieces well.Add chicken pieces, ginger-garlic paste, red chili powder, turmeric powder, coriander powder, pepper powder, salt to taste into a large bowl and mix well to combine.
Next add gram flour, corn flour, and mix again to coat all chicken pieces well.finally add the egg and mix again.
Cover and let it sit in the fridge to marinate for about 15 minutes.Heat oil in a Pan for deep frying, on a medium flame.Add a handful of chicken pieces into the oil separately.
Do not over crowd the kadai.
Remove from oil when cooked well and crisp and drain excess oil on kitchen towel.Repeat deep frying all the chicken pieces in batches.
At last slit green chilies and curry leaves into the oil and mix with the deep fried Chicken Pakoda and serve hot.Serve Crispy Chicken Pakoda immediately with tomato sauce or any delicious dip like Mirchicha Chatka or Peanut Chilli Dipping Sauce during tea time.","chicken, corn flour, eggs, gram flour ",https://www.archanaskitchen.com/images/archanaskitchen/1-Author/Jyothi_Rajesh/Chicken_Pakoda.jpg,,
162,Turkish Chicken Gozleme Recipe-Stuffed Spinach Chicken Bread,"To begin making the Turkish Chicken Gozleme Recipe, we will first knead the dough for the bread and keep it ready.In a mixing bowl add all the flour, curd, salt to taste and knead well with little water to form a firm dough.
Once done cover with a damp cloth and rest the dough.For the Gozleme StuffingHeat a skillet on medium heat with oil, add chopped garlic and saute till it softens.
Add chopped onions and saute till they turn golden brown.Add in tomatoes and sprinkle little salt and cook until the tomatoes turn mushy.
At this stage add the minced chicken and add all the spice powders, paprika, cumin, coriander and pepper.
Saute till the chicken is cooked.
This will take about 3 to 4 minutes.Once done add chopped spinach leaves and mint leaves to the chicken Gozleme mixture and saute till the leaves wilt and all the moisture is evaporated.Check for seasonings and adjust if required.
Once done turn off the heat and allow it to cool down.To make the Chicken GozlemeDivide the dough the into 3 equal portions.
Take one portion and flatten it on the rolling surface, dust it with some flour and roll it flat to thin  circle.Add the chicken stuffing in the centre, sprinkle the chopped spring onions and crumbled feta cheese on top.Fold the dough from either side and seal it tightly so that it doesn’t open up.
You will get a rectangular shaped flat stuffed bread - Chicken Gozleme.Heat a flat skillet, place the Chicken Gozleme and toast it on either side for couple of minutes until you see the dough is getting partially cooked.Drizzle oil on the Chicken Gozleme and cook till your notice brown spots on both sides.
Once done, remove the Chicken Gozleme from the pan and serve hot.Serve the Turkish Chicken Gozleme Recipe along with Pickled onions, lemon wedges and Couscous Raw Mango Salad by the side to make weekend meals special.","tomato, wheat flour, hung curd ,onion, chicken,  cheese, flour , spinach leaves ",https://www.archanaskitchen.com/images/archanaskitchen/1-Author/sibyl-archanaskitchen.com/Turkish_Style_Chicken_Golzeme_Recipestuffed_Bread_with_Spinach__Minced_Chicken_.jpg,,
163,Moon Biscuits Recipe (Moon Shaped Baked Cookies),"To begin making Moon Biscuits Recipe (Moon Shaped Baked Cookies), first take maida, milk powder, and baking powder and combine them well.Now add the softened butter, confectionery sugar (powdered sugar) and vanilla extract into a bowl.Combine the butter mixture well and add in the dry ingredients and make a dough.Now preheat the oven at 350°F,take a rolling pin and flatten the dough by using a round cookie cutter cut the dough in to moon shape cookies.Arrange them on baking tray now set the cooking time to15 mins and place the tray into the oven.
Cool them before serving.Serve Moon Biscuits Recipe (Moon Shaped Baked Cookies) during tea time with Masala Chai Recipe - Indian Spiced Tea and Karachi Biscuits Recipe.","maida, vanilla, milk powder",https://www.archanaskitchen.com/images/archanaskitchen/Dessert_Cookies/Moon_biscuits_recipe.JPG,,
164,Andaman Style Steamed Garlic Prawns Recipe,"To begin making the Andaman Style Steamed Garlic Prawns recipe, in a heat proof boil collect chopped garlic and green chilies and keep aside.
Heat vegetable oil in a pan till smoking hot, and pour the hot oil immediately over the chopped garlic and chilies.
Wait till they crackle and leaves and aroma.
Set aside to cool.While the garlic oil is cooling, set up a steamer and place the prawns in a pan/plate that will go inside the steamer.
Pour the garlic infused oil all over the prawns and gently rub them, season with some salt and set to marinade till the steamer gets ready.
Now steam the prawns for around 8 to 10 minutes.
Meanwhile mix soy sauce and sesame oil in a small bowl.Take out the cooked prawns and spoon the sauce mix all over.
Sprinkle some freshly crushed black pepper and some chopped coriander.
Drizzle some lemon juice over the prawns if you like or else skip it.
Serve hot.
Serve Andaman Style Steamed Garlic Prawns as a side dish along with steamed rice and Jeera Rasam for a weekday meal."," garlic,  sauce, lemon, prawns",https://www.archanaskitchen.com/images/archanaskitchen/1-Author/shaheen_ali/Andaman_Style_Steamed_Garlic_Prawns_.jpg,,
165,Fruit Pachadi Recipe,"To make fruit pachhadi, firstly grind coconut, green chilli and mustard after adding some water in the mixer grinder.
Keep it aside.
Now heat a pan.
Add chopped fruits and 2 tablespoons of water to it.
Allow the fruits to cook until they become soft.
After softening add turmeric powder, salt and sugar / jaggery to it.
Mix and add coconut paste.
Cook for 2 minutes and then turn off the gas.
Add yogurt to it and mix well.
Now heat oil in a small pan.
Add mustard seeds, dry red chillies and curry leaves.
Let it cook for 1 minute and then give it the dal in the tempered fruit pachhadi.
Mix and serve.
Serve the fruit pachhadi with keerai sambar, rice and papad for dinner.","yogurt, coconut , fruit ",https://www.archanaskitchen.com/images/archanaskitchen/1-Author/sapanabehl/Fruit_Pachadi_edited.jpg,,
166,Aloo Matar Masala Khichdi Recipe,"To begin making Aloo Matar Masala Khichdi Recipe, wash the rice and keep it soaked in water till you add it into the recipe.Wash, de-skin, cut the potatoes into big cubes and keep it immersed in a bowl of water until further cooking.Heat ghee in a pressure pan, add the whole spices - bay leaf, black and green cardamoms, cinnamon, cloves and let it release its flavours into the ghee.Add the cumin seeds and let it splutter.Add the sliced onions, green chilies and saute until the onions turns translucent.Drain the potatoes from water and add it to the pressure pan along with peas and saute for a minute.Add the coriander powder, cumin pepper and red chilli powder and mix well.Add the drained and soaked rice, about 5 cups of water, season with salt and bring it to a rolling boil.Close it with the pressure pan lid and cook for 4 to 5 whistles, or till done.Switch off the heat, let the pressure release on its own before opening the lid.Garnish with coriander leaves use a fork to carefully mix the khichdi.Serve the Aloo Matar Masala Khichdi Recipe along with Cauliflower & Cucumber Raita Recipe and Papad for a simple yet delightful weeknight dinner."," rice,  green pea,onion,  potato ",https://www.archanaskitchen.com/images/archanaskitchen/1-Author/nithya.anantham/Aloo_Matar_Masala_Khichdi_Recipe.jpg,,
167,Rock Bread Recipe ,"To begin making the Rock Toast, in a mixing bowl, combine semolina, yogurt, onion, capsicum, coriander leaves, green chilli, salt and pepper powder.Adjust the topping mixture with a little water, making sure you get a spreadable consistency.
Let it sit aside for about 5-7 minutes.
 In the meanwhile, heat a griddle on medium flame, spread some oil.Take a slice of bread, spread the semolina topping on it with a spoon and place the bread in a way that the topping is  facing  down on the griddle.Cook this on medium-high heat for about three minutes and flip.Remove from the tawa and serve hot.Serve this Rock Toast along with tomato ketchup or Dhaniya Pudina Chutney and Homemade Pomegranate Juice with Ginger Recipe","tomato,onion , curd, capsicum, sooji, bread ",https://www.archanaskitchen.com/images/Rock_Toast_Semolina_Bread_Toast_Recipe_Spiced_With_Green_Chilli-5.jpg,,
168,Potato Vindaloo Recipe (Spicy Goan Potato Curry),"To begin making Potato Vindaloo Recipe first place a large sauce pan or heavy bottomed pot on the heat.Add the chopped potatoes into it, cover them with water, add a little salt and place it on the heat.
Bring it to a boil and simmer it until the potatoes are par-cooked.
They should be soft when a knife is inserted into them, but they shouldnt be mushy and give way.Strain the potatoes, reserving some boiled water separately, and keep both aside for later use.In a mixer jar add all the ingredients under ""For the Vindaloo paste"" list and grind them into a fine, smooth paste.Next, place a kadai on the heat, add some oil and mustard seeds to it.
Allow it to sputter, and then add curry leaves.When the curry leaves are crisp, add the vindaloo paste and saute until the raw smell goes away and oil begins to separate at the edges.Add 1/2 cup of reserved water in which the potatoes were cooked water, the boiled potatoes, check for salt and adjust as required.Cook the curry together, stirring in between until the curry thickens.
This may take 10-12 minutes.Sprinkle some sugar and stir once before switching off.
Add additional curry leaves in the end and serve hot with Vegetable Biryani and Raita or Bread."," potato, vinegar",https://www.archanaskitchen.com/images/archanaskitchen/1-Author/Divya_Shivaraman_/Potato_Vindaloo.jpg,,
169,Lu Potol Post Recipe (Lu Parwal In Poppy Seed Masala Recipe),"We begin making Aloo Potol Posto Recipe (Aloo Parwal in Poppy Seed Masala Recipe) heat the pan with oil and roast by adding methi,cumin, fennel,cloves,cardamom, dry red chilli along with ginger, grated coconut and poppy seeds.
Fry till the aroma comes out.Cool and transfer it into a blender.
Blend it to a fine paste and keep it aside.Heat oil in a kadai and saute the parawal with turmeric powder till it turns brown and softens.Remove and keep it aside.
Keep the potatoes boiled and ready as well.
With the leftover oil temper green chilies and add the (coconut-poppy seed) masala paste.
Sprinkle the spice powders and fry till the oil comes out from the masala.Finally add the vegetables.
Add water and cook it for some more time for about 10 minutes .Serve your delicious and spicy Aloo Potol Posto (Aloo Parwal in Poppy Seed Masala) with layered Lachaa Paratha."," coconut,  potato ",https://www.archanaskitchen.com/images/archanaskitchen/0-Archanas-Kitchen-Recipes/2016/sept-26/Bengali_Aloo_Potol_Posto_Recipe_Aloo_Parwal_In_Poppy_Seed_Masala-1.jpg,,
170,Aloo Bhey Ki Sabzi Recipe (Potato Lotus Stem Curry),"To begin making the Aloo Bhey Ki Sabzi Recipe, we will first prep all the various components.First of all, place the ingredients listed under “Ingredients to be made into a paste” into a blender and grind them down into a smooth paste.
Pour it into a bowl and set it aside for later.Then add 3 small tomatoes into the blender and blend them to a puree.
Pour the puree into a bowl and set that aside too.Now to make the sabzi, heat some oil in a pressure cooker.
When it is warm enough, add asafetida and cumin seeds and let them crackle.Next add the prepared onion garlic paste and saute well for 3-4 minutes until the paste turns golden-brown and the raw smell goes away.Next add the red chilli powder, turmeric and coriander powder.
Top with salt and continue to cook for 2 minutes more.At this stage, when the masalas are all cooked through, pour in the prepared tomato puree and cook for another 3-4 minutes, stirring continuously, until you see oil leaving the sides of the pan.
This is an indication that the masalas are cooked through.Now add cubed potato and lotus stem rounds, stir well and cook for 2-3 minutes.Top it up with 2 cups of water and cover the pressure.
Allow the sabzi to cook covered for 2 whistles.Turn the heat off and allow the pressure to release natural.
When the weight can be lifted and the lid comes off with ease, open the cooked and simmer the sabzi for 5 minutes.
This will allow some excess water to evaporate.
At this stage you can taste for salt and spice and adjust both accordingly.When done, take the pressure cooked off the heat, pour the sabzi into a serving bowl and serve hot with Phulkas and Pumpkin Dal Tadka","tomato,  onion, lotus stem, potato ",https://www.archanaskitchen.com/images/archanaskitchen/1-Author/Sapana_Behl/Potato_Lotus_Stem_Curry.jpg,,
171,Classic Grilled Tomato Cucumber Chutney Sandwich Recipe,"To begin making the Classic Tomato Cucumber Chutney Sandwich with Chutney Recipe, arrange two slices of bread next to each other.Spread tomato ketchup on one slice and the Dhaniya Pudina Chutney on the other slice.
Arrange the sliced tomato & cucumber slices on one of slice.
Sprinkle some chaat masala powder, pepper powder and salt.
Close the sandwich with the other slice.Heat a grill sandwich maker, lightly spread butter on the outside and cook until  it turns golden brown, around 3-4 minutes or when the light turns off on the sandwich maker.If you don't have a sandwich maker, you can grill the sandwich on the tawa no medium heat until each one of the sides turn golden brown and crisp.
Once the Tomato Cucumber Chutney Sandwich is grilled well, place it on a platter and cut into triangles and serve.Serve the Classic Grilled Tomato Cucumber Chutney Sandwich for a quick weeknight dinner and serve it along with Indian Style Beetroot Soup Recipe and Bean Sprout & Corn Salad Recipe for a weeknight dinner, simple serve the sandwich along with a glass of Chikoo Banana Date Smoothie as an after school snack for kids.","tomato, bread,  cucumber, green cilli",https://www.archanaskitchen.com/images/archanaskitchen/1-Author/sneha-archanaskitchen.com/Classic_Grilled_Tomato_Cucumber_Sandwich_With_Chutney_Recipe_.jpg,,
173,Baingan Sarson Ka Saag Recipe,"To begin making Baingan Sarson Ka Saag Recipe first prep all the ingredients and keep aside.
Quarter the brinjal and keep them in salted water till you use them.
Keeping them in salted water prevents discolouration of the brinjal.Wash and chop the mustard greens ( sarson ka saag) roughly and keep them aside.
Next heat oil in a deep pan or wok and once the oil has reached a smoking point reduce the heat to medium.
Add cumin seeds and let them crackle.
Then add onions, ginger and garlic and saute till the onions are cooked.Now add the drained and cut brinjal slices to the pan and saute.
Sprinkle some water, cover and cook the brinjal till its cooked through and is well roasted.This will take about 4 to 5 minutes.Once the brinjal is well roasted, softened and cooked through, add all the dry spices to the pan, chilli powder, turmeric powder, coriander powder, garam masala powder, amchur powder, salt and saute for a minute till all the brinjal is well coated with the masalas.
Finally add the chopped mustard leaves to the brinjals and cover and cook till the mustard greens are cooked through.
This will take about 3 to 4 minutes as well.Check the salt and seasonings of the Baingan Sarson Ka Saag and adjust according to taste.Once done, turn off the heat and transfer the Baingan Sarson Ka Saag to a serving bowl and serve hot.Serve Baingan Sarson Ka Saag with Phulka , Panchmel Dal and Lauki Raita for a lovely weekday lunch.","amchur , brinjal , onion, ",https://www.archanaskitchen.com/images/archanaskitchen/0-Affiliate-Articles/Baingan_Sarson_Ka_Saag_Recipe_3_1600.jpg,,
175,Chettinad Thakkali Sadam Recipe (Chettinad Style Tomato Rice),"To begin making Chettinad Takkali Sadam Recipe, cook the rice to a fluffy texture and keep aside.Also, coarsely pound the ginger, garlic and fennel seeds using a mortar and pestle and keep aside.Heat ghee in a pan on medium flame, add the cinnamon stick and cloves and let it splutter.Add the ginger, garlic and fennel seeds mix and saute until the raw smell goes away.Add the curry leaves and sliced onions and saute until the onions turn translucent.Add the tomatoes and saute until its half cooked.Now, add the slit green chilli, red chilli powder, mint and coriander leaves and mix well.Season with salt and cook the mix until the tomatoes are well cooked and the whole mixture comes together.
This will take around 10 minutes.Now, add the cooked rice and mix it evenly using a fork.Let it simmer for 5 minutes and switch off the flame.Serve the Chettinad Takkali Sadam Recipe along with Cauliflower & Cucumber Raita Recipe (Cauliflower Yogurt Salad) for lunch or for kids lunchbox.","tomato, rice, mint leaves (pudina) fistful, fennel seeds (saunf), cloves garlic, onion, cinnamon stick (dalchini), cloves (laung)",https://www.archanaskitchen.com/images/archanaskitchen/1-Author/nithya.anantham/Chettinad_Takkali_Sadam_Recipe_Chettinad_Style_Tomato_Rice.jpg,,
176,Thai Yellow Coconut Curry Rice Recipe,"We begin making the Thai Yellow Coconut Curry Rice Recipe by boiling  milk and 1 cup of water in a sauce pan.In the meantime roast the cumin seeds, coriander seeds, fennel seeds, peppercorns and cinnamon sticks slightly.
Once that is done grind it along with the rest of the ingredients in a mixer to a smooth paste.Add this paste along with rice and bring it to a boil.
Cook till the rice till it becomes soft and cooked.
In the middle when the rice start to absorb all the moisture add the lime leaves and lemon grass.In another pan, heat oil and saute the onions,ginger, garlic, bell peppers and cluster beans .
Cook till it is soft and crunchy.Add these vegetable to the rice along with jaggery.
Give it stir and make sure the rice does not stick to the bottom of the pan.
Once the rice cooked taste for salt and season it well.At the end drizzle some lime juice and serve Serve the Thai Yellow Coconut Curry Rice Recipe as a one pot meal for a Sunday Lunch"," rice,  onion,capsicum,coconut milk",https://www.archanaskitchen.com/images/archanaskitchen/0-Archanas-Kitchen-Recipes/2017/8-Feb/Thai_Yellow_Coconut_Curry_Rice_Recipe-2.jpg,,
177, Stuffed Bhindi With Paneer (Recipe In Hindi),"To make Paneer Bharam Bhendi, first wash the lady finger and dry it well.
After that cut her steams.
Cut out the seeds, take out the seeds and keep them on the side.
To make the Bharam Masala, combine the ingredients of Paneer Masala in a bowl.
Mix well and keep it on one side.
Fill this spice well in the lady finger.
Fill the sari lady finger and keep aside.
Now grease a microwave safe tray with oil and place the sari lady finger on it.
Allow the lady finger to cook for 3 to 4 minutes.
Now heat the oil in a pan.
Add cumin, asafoetida to it.
After that add chopped onion, ginger, garlic and cook till the onion is cooked.
Add grated tomatoes and cook on high heat.
If there is leftover stuffing masala, then mix it in the pan.
After the tomatoes are cooked, add okra in it and mix well.
Beat the pan and cook until the lady finger is soft.
After cooking add some lemon juice and chaat masala to it and serve.
Serve Paneer Bhama Bhindi with Gujarati kadhi and roti with gum hot.","tomato,  onion,  cheese ",https://www.archanaskitchen.com/images/archanaskitchen/dry_vegetables/Stuffed_Bhindi_With_Paneer_Recipe.jpg,,
178,Bael Ka Sharbat Recipe - Wood Apple Squash Drink,"To begin making the Bael Ka Sharbat recipe, muddle the mint leaves and keep aside.Break open the fruit by hitting on the floor.
Scoop out the pulp in a large bowl using a spoon or a scooper.Pour in some water and mash the pulp with your hands so as to separate the seeds.Now strain the liquid using a sieve separating the seeds and the fiber.
Repeat the process once again, adding some more water.Add sugar/ jaggery, lemon juice and the remaining spices which includes black salt and cumin powder.
Add in the muddled mint leaves.Add water, ice cubes and mix Bael Ka Sharbat properly.
Adjust the quantity of the spices according to your preference and serve.Serve Bael Ka Sharbat on its own as a summer drink to your family.
You can also serve this to your guests as a welcome drink along with Baked Chevdo Recipe (Chivda Mixture -Tea Time Snack) and Baked Mathri Recipe (Non Fried Tea Time Snack)."," ice cubes,  sugar, wood apple ",https://www.archanaskitchen.com/images/archanaskitchen/1-Author/Manisha_Goyal/BAEL_KA_SHARBAT__WOODAPPLE_SQUASH__STONEAPPLE_DRINK__an_Indian_summer_drink.jpg,,
179,Raw Mango Murabba Recipe - Cinnamon Spiced Mango Jam,"To begin making Raw Mango Murabba Recipe, peel the mangoes and cut the in cubes and set aside.In a saucepan, add the sugar & 1/2 cup water and make a thin syrup.Once the syrup starts boiling, add the mango cubes, add the saffron strands & cinnamon powder, simmer on low flame, until the mango pieces are cooked.This will take 5 minutes more.Remove the Raw Mango Murabba from the flame & let the murabba cool.Once cooled, store the Raw Mango Murabba Recipe in a glass jar or steel jar.The Raw Mango Murabba Recipe can be stored for more than 6 months in the fridge & can be enjoyed with hot Spicy Yogurt Chapati Recipe or Whole Wheat Bread Recipe With Oatmeal And Flaxseeds.",mango ,https://www.archanaskitchen.com/images/archanaskitchen/0-Archanas-Kitchen-Recipes/2018/Raw_Mango_Murabba_Recipe_-_Cinnamon_Spiced_Mango_Jam_-1.jpg,,
180,Karnataka Style Gorai Kai Kara Recipe - Cluster Beans Chutney,"To begin making the Karnataka Style Gorai Kai Kara Recipe (Cluster Beans Chutney Recipe), firstly begin by washing the cluster beans and removing the two pointed ends.
Chop them half and keep it aside.Heat a kadai with oil and splutter cumin seeds, coriander seeds and curry leaves.
Add the chopped onions and sauté them till it turns translucent.Once the onions are translucent, add the chopped garlic, ginger, green chilies and the cluster beans.
Add salt and fry them till it is cooked.
You can cover it with the lid and let it cook over medium heat.Once that is done let it cool down and add it in a mixer along with tamarind and roasted peanuts.
Grind this into a smooth paste.
The next step is to make the tempering for the chutney.
Heat required oil in a tadka pan.
When the oil is hot, add in the mustard seeds, urad dal, asafoetida, curry leaves and let the mustard seeds splutter.
Once done, switch off the gas and pour the tempering over the chutney and give it a mix.
Your chutney is ready to be served.Serve the Karnataka Style Gorai Kai Kara Recipe along with Ghee Roast Dosa and Filter Coffee for your morning breakfast.","peanuts (moongphali) dry, asafoetida (hing), cloves garlic, white urad dal (split), gawar phali (kothavarangai cluster beans), tamarind",https://www.archanaskitchen.com/images/archanaskitchen/1-Author/sibyl_sunitha/Karanataka_Style_Goraikai_Kara_Recipe_Cluster_Beans_Chutney_Recipe_.jpg,,
