Recipe ID,Recipe Name,Recipe Information,ingredients,Image URL,,
337,Pasta Primavera With Fresh Basil Recipe,"To begin making Pasta Primavera With Fresh Basil Recipe, steam broccoli, potatoes, corn, carrot and beans with little salt.
You can use a steamer, pressure cooker or microwave for steaming your vegetables.
Click here to see how to cook vegetables in a pressure cooker.Place a saucepan on medium heat.
Add water and salt to it and let it boil.
Add the spaghetti and cook according to the packaged instruction.
Drain the spaghetti in a colander.
Reserve 1/3 cup of drained water.Meanwhile start preparing for the sauce.
Place a pan on medium heat and add oil to it.Add chopped garlic and red chili flakes.
Fry till the garlic starts releasing aroma.
At this stage, add the sliced onions and saute till the onions turn transparent.
Do not brown the onions.Add the steamed vegetables.
Sprinkle little salt and saute on medium heat for 2 minutes.Add the capsicum, tomatoes and half of the chopped basil.
Saute the vegetable mixture for 2-3 minutes.At this stage, add the cooked spaghetti.
Give it a good mix with all the vegetables.
Mix it for 1-2 minutes.
Add the drained water and let it simmer for 1-2 minutes.Turn off the heat.
Squeeze 1/2 tablespoon lemon juice.
Mix well and adjust the salt if required.Take out a portion of the pasta in a serving plate.
Garnish it with basil, grated parmesan cheese and chili flakes.
serve the Pasta Primavera With Fresh Basil Recipe along with Garlic Bread with Herb Butter Recipe and a glass of chilled wine.You can also add mushrooms, olives, zucchini, spinach etc.
to make it vibrant and nutritious.
Pour some good extra virgin olive oil just before serving the dish.
It brings out the fresh flavors of the basil and veggies.","green beans , cheese, pasta,   onion, potato, green bell pepper ",https://www.archanaskitchen.com/images/archanaskitchen/1-Author/Sayantani/Pasta_Primavera_Recipe.jpg,,
338,Assamese Style Dil Pasand Recipe,"To prepare Assamese Style Dil Pasand Recipe, in a bowl add flour, salt, sugar and soda give it a mix.
Next add water little at a time and knead the dough into stiff dough.
Cover and keep the dough aside for 30 minutes.Heat a pan.
Add grated coconut and roast it until it begins to turn brown.Next add sugar and roast until the mixture is dry.Add crumbled khoya and continue to cook till all the ingredients comes together.
Finally add raisins and nuts mix, give it a good mix.
Keep aside to cool.Make equal portions of dough and filling.Heat oil/ghee in a deep bottom wide pan for deep frying.Roll a portion of the dough into 3 inch diameter.
Place a portion of filling in the center, bring all the ends of the dough together and seal it well.Now dust a little flour on the surface and roll gently the filled dough into 3 to 4 inch diameter circle.
Repeat the above step for all the dough.Once oil turns hot reduce the flame down to medium low.Carefully drop a puri into the hot oil and fry it until it puffs up and turns brown on both sides.
Remove from oil once cooked and drain it on kitchen towel.Serve Assamese Style Dil Pasand Recipe hot immediately during tea time.","khoya. sunflower , coconut, raisins,flour, mixed nuts",https://www.archanaskitchen.com/images/archanaskitchen/1-Author/jyothir/Assamese_Style_Dil_Pasand_Stuffed_Sweet_Puris.jpg,,
330,Kothavarangai Paruppu Usili Recipe - Gawar Phali Dal Sabzi,"To begin making Kothavarangai Paruppu Usili recipe, soak Toor Dal in water for about an hour.
Meanwhile, add finely chopped cluster beans/kothavarangai/gawar phali to a pressure cooker along with salt to taste, 2 tablespoons water and turmeric powder.
Mix well.
Pressure cook for 2 whistles and release the pressure immediately by running the pressure cooker under water.
Open the cooker lid and keep aside.After 1 hour, drain water from soaked Toor Dal.
Add the drained Toor Dal along with red chillies and salt in a mixer.Coarsely grind the ingredients and keep aside.
Make sure to grind the soaked dal coarsely by adding no or very little water.
Add water in the idli pan for steaming, grease the idli plates with little oil and add the coarsely ground paruppu usili mixture to the idli plates.Steam the paruppu usili for around 1o minutes until the ground toor dal is cooked completely.
Turn off the heat, remove the steamed toor dal, crumble it and keep aside.
The next step is to temper the Kothavarangai Paruppu Usili.In a pan, add a tablespoon oil.
Once the oil is heated, add the mustard seeds, urad dal and curry leaves.
Once the mustard seeds sputter and dal turns golden brown, add steamed paruppu or toor dal into the pan and fry it for a few minutes.
This will help the dal lose the moisture if there is any, so that it gives the crumbly texture.
Next, add the cooked Kothavarangai/Gawar Phali and give it a good mix.
Adjust salt according to your taste.
Mix well, keep it covered for 2 minutes and turn off the heat.
Transfer the Kothavarangai Paruppu Usili to a serving bowl and serve hot.Serve Kothavarangai Paruppu Usili along with Mor Kuzhambu, Steamed Rice and Elai Vadam for a delicious Sunday lunch.","toor dal,urad dal, gawar phali",https://www.archanaskitchen.com/images/archanaskitchen/1-Author/ramsarun11-gmail.com/_Kothavarangai_Parupu_Usili_Recipe_1600.jpg,,
340,Broccoli And Aloo Lifafa Paratha Recipe,"To begin with Broccoli And Aloo Lifafa Paratha Recipe, we will first make the dough ready.
Take a Mixing Bowl.
Mix 1 cup Vivatta Whole Wheat flour with water, oil and salt.
Add a little water at a time and keep on mixing it with your fingers till the dough reaches a soft consistency.
Once the dough becomes smooth and soft, cover and keep the dough aside for 30 minutes.
Meanwhile proceed to make the broccoli and potato stuffing.
To make the broccoli and potato  stuffing, in a Mixing Bowl and add the boiled and mashed potato, steamed and mashed broccoli, cumin seeds, garam masala, black pepper powder and freshly chopped coriander leaves.Add salt to it.
Add lemon juice and mix all the ingredients well.
Keep it aside.The broccoli and potato mixture is now ready.
In a small bowl, mix the cornflour and water to make a smooth paste.Once the dove is well rested, make 6 small balls of equal size from the dough.
Sprinkle some dry flour on the rolling board and flatten the ball into a round shape using a rolling pin similar to making a roti.Heat a Cast Iron Tawa and semi cook the flattened roti from both the sides.Once fine bubbles start appearing on the roti, remove it from the tawa and spread good amount of broccoli and potato stuffing right at the center and spread it around leaving a little space from the sides to close the paratha into an envelope shape.Once the broccoli and potato mixture is evenly spread, apply the  corn flour paste at the edges where the stuffing is not present.Apply corn flour paste on the edges of the roti.
Fold the 2 opposite corners of the roti over the stuffing.
Now fold the remaining 2 edges sealing the filling well.
This will look like a folded envelope.Place the stuffed broccoli paratha over hot tawa, drizzle oil or ghee and cook on both sides until they turn brown on both sides.
Using the same process, make the remaining parathas.Serve the Broccoli And Aloo Lifafa Paratha for you breakfast, packed lunchbox or weeknight dinner with Raw Mango Raita and Dhaniya Pudina Chutney."," knead, flour, corn flour, broccoli , potato ",https://www.archanaskitchen.com/images/archanaskitchen/1-Author/Raksha_Kamat/Brocolli_And_Aloo_Lifafa_Paratha_original.jpg,,
341,Eggless Mango Cheesecake Recipe,"To begin with Eggless Mango Cheesecake, take a spring form pan and line the bottom and sides with parchment paper or wax paper.Mix 1/3 cup melted butter with 1 1/2 cup crushed digestive cookies till everything is mixed properly.Press the cookie butter mix to the bottom of the springform pan with your fingers or wide spoon to form a firm base for the cheese cake.Microwave 1/4 cup water in a bowl for 1-2 minute or till it boils.
Add gelatin to the hot water and mix till it dissolves completely.Add the gelatin mix to 3/4 cup of mango puree and keep it aside.Blend cream cheese, sugar and milk in a blender till everything is mixed well.
Now add the mango gelatin mix to the blended mix.
Blend all together.Pour the mix over the cookie base.
Cover with a cling wrap and refrigerate for at least 2-4 hrs or overnight.Serve Mango Cheesecake after your meal with Scrambled Egg Cucumber Sandwich and Masala Chai during your tea time parties.","cheese, britannia, mango pulp,  milk, biscuit, gelatin unflavoured, kiwi berries mango",https://www.archanaskitchen.com/images/archanaskitchen/1-Author/Rupal_Patel/Mango_Cheesecake.jpg,,
342,Cheesy Bruschetta With Capsicum And Tomatoes Recipe,"To begin making the Cheesy Bruschetta With Capsicum And Tomatoes recipe, In a bowl add chopped tomatoes, onions, capsicum, basil/cilantro, dried oregano, lemon juice, salt, black pepper powder.Mix everything well and cover it with the plastic wrap and let it sit for an hour.Cut baguette into 1/2 inch slices.Spread Del Monte's Olive Oil or butter on one side of the each bread slice and put it into the preheated 400 F oven on a baking sheet for 5 to 7 minutes.Place some tomato, capsicum & onion mixture on each bread slice.
Add some grated mozzarella cheese over it.Put the bread again in the oven until the cheese has melted.Garnish with the chopped basil and serve immediately.
Serve Cheesy Bruschetta With Capsicum And Tomatoes with Fresh Tomato Basil Pasta with Spinach.","tomato, french loaf,cheese,onion, butter, green bell pepper , dried oregano",https://www.archanaskitchen.com/images/archanaskitchen/1-Author/Aarti_Sharma/Cheesy_Bruschetta_with_capsicum_and_tomatoes.jpg,,
343,Uddina Hittu Recipe (Udnittu) | Urad Dal Flour In Spiced Buttermilk,"To begin making Uddina Hittu Recipe (Udnittu) | Urad Dal Flour In Spiced Buttermilk, take a big mixing bowl and add sour buttermilk to it.
Crush green chillies, grated ginger and salt into it.
Add urad dal flour to it and mix such that there are no lumps in it.
Prepare tempering.
Heat a small tadka pan, heat coconut oil and when the oil is hot, add mustard seeds.When the mustard seeds splutter, add generous pinches of hing, curry leaves and broken mor milagai.
Pour the tempering over the curd-urad dal mixture and mix well.Serve Uddina Hittu Recipe (Udnittu) | Urad Dal Flour In Spiced Buttermilk topped with mor milagai (majjige menasinakai) along with steamed rice for lunch.
","urad dal flour,  buttermilk sour, coconut oil, mor milagai",https://www.archanaskitchen.com/images/archanaskitchen/1-Author/Smitha-Kalluraya/UDNITTU__UDDINA_HITTU_.jpg,,
344,Konkani Style Doddak Recipe-Lentil Pancakes,"To begin making the Doddak Recipe, wash and soak the split urad dal for 1 hour in enough water.
Grind it to a smooth fluffy batter in a mixer grinder by adding enough water.Take this mixture out in a big mixing bowl, add the idli or normal rava, grated ginger and green chilli, season with salt and make a thick batter with little water.The consistency of the batter should be little thicker than the dosa batter.Heat a skillet in medium heat, grease it with a little oil and pour a laddle full of this doddak batter an spread to a thick 4 inch diameter in size.Smear a little oil on the sides and let it cook on one side.Once done, flip over and cook the other side and remove it in a plate.Similarly, prepare the Doddaks with the remaining batter and serve hot.Serve Doddak Recipe along with South Indian Coconut Chutney or Carrot Chutney for breakfast or as a quick lunch box recipe for kids.","urad dal, sunflower oil , sooji",https://www.archanaskitchen.com/images/archanaskitchen/1-Author/Nithya_Anantham/Doddak_Recipe_Konkani_Lentil_Pancakes.jpg,,
345,Eggless & Gluten free Oats Banana Brownie Recipe,"To prepare Eggless & Gluten Free Oats Banana Brownies recipe, dry roast the rolled oats in a pan on low heat for two minutes.
Cool for 3-4 minutes and then grind it in a mixer at high speed into a fine powder.Preheat Oven to 350F or 180 degrees Celsius.
Line a brownie pan with parchment paper or if using an aluminum foil, grease it with cooking spray.Sieve the powdered oats flour and measure 1/2 cup.
Add baking powder, baking soda and salt into the fine oats flour and mix it evenly.Mash the banana in a bowl using a fork.
Add the flaxseed meal in about 3 tablespoons of lukewarm water.
Stir and mix till it is frothy.In a large bowl, beat sugar, oil and the flax seed mixture using an electric mixer for about 2 minutes.Add vanilla extract and cocoa powder and beat it at low speed till you get a smooth and creamy mixture.
Do not overbeat.Add mashed bananas and flour into the bowl.Add the chopped walnuts and chocolate chips into it.
Stir and mix well so the oats flour is well incorporated.Grease the baking pan and dust with flour.
tap off the excess flour.Pour the batter into the prepared pan and bake for 35-40 minutes.
When done, the edges of the brownies will be visibly baked through and the center will be set (that is, not wiggly) when you shake the pan.Try to look for the first sign of cracking on the brownie’s top—which should be shiny and set which means that the brownies are cooked and then pull them out.Cool down the brownies completely in the pan on a wire.
After the brownies are completely cooled, after an hour, cut them into neat squares.You can store in an air-tight container to serve with a hot cup of coffee or a scoop of vanilla ice cream during tea-time.
You could also serve it with warm chocolate ganache as dessert after dinner.
","bananas, oats,cocoa, chocolate chips, flax seed ,walnuts",https://www.archanaskitchen.com/images/archanaskitchen/Dessert_Cakes/eggless-oats-banana-brownie-recipe.jpg,,
346,Turai Aloo Ki Sabzi Recipe - Ridge Gourd Potato Curry,"To begin making the Turai Aloo Ki Sabzi, firstly prepare all the ingredients required for the sabzi and keep it aside.Heat oil in a heavy bottomed pan.
Once it is hot, add mustard seeds and cumin seeds.
Let it splutter.Add garlic and ginger, saute till the raw smell disappears.
Soon after they splutter, add in onions and saute till translucent.Add tomatoes and cook till tender and mushy.Add potatoes, saute for few minutes and add the turai cubes in it and occasionally saute.
Keep the sabzi covered while cooking.
Add water just enough to make a curry like consistency.Once the potatoes and ridge gourd are cooked, add in the remaining spices including cumin powder, turmeric powder, coriander powder, red chilli powder, garam masala powder and saute till combined well.
Check the salt and spices adjust to suit your taste.Let it cook for 4 to 5 minutes more and serve hot.Serve Turai Aloo Ki Sabzi Recipe along with Tomato Onion Cucumber Raita and Phulka for your everyday meals.","tomato,  potato , ridge gourd ,onion",https://www.archanaskitchen.com/images/archanaskitchen/0-Archanas-Kitchen-Recipes/2017/0-Archana/Turai_Aloo_Ki_Sabzi_Recipe_Video-3.jpg,,
347,Pachai Payaru Payasam Recipe - Green Moong Dal Payasam,"To begin making the Pachai Payaru Payasam Recipe wash and soak the green moong dal in 3 cups of water overnight or for a minimum of 3 - 4 hours.
After 4 hours, transfer the green moong dal along with the water to a pressure cooker.Pressure cook for about 4-5 whistles, and turn off the heat.
Allow the pressure to release naturally.
Once the pressure is released naturally set the green moong dal aside.
Heat a sauce pan on medium flame, combine the jaggery with water, allow the jaggery to melt and bring this syrup to a brisk boil.
Reduce the flame, add the cooked green moong dal and cardamom powder.
Turn off the flame, add the coconut milk and mix well.
Transfer the Pachai Payaru Payasam to a serving bowl, stir in the saffron strands and set aside.
Heat a small tadka pan on medium flame, add ghee and fry the cashew nuts until golden brown and crisp.Turn off the flame and pour it over the Pachai Payaru Payasam.
Serve Pachai Payaru Payasam Recipe along with a South Indian meal that consists of Steamed Rice, Chettinad Style Poondu Rasam Recipe - Garlic Rasam Recipe, Beetroot Poriyal Recipe (Stir Fried Beetroot), Cabbage Poricha Kootu Recipe - South Indian Cabbage Dal, Puri Recipe.","saffron strands, cashews, coconut milk, moong dal",https://www.archanaskitchen.com/images/archanaskitchen/0-Archanas-Kitchen-Recipes/2020/Green_Moong_Dal_Payasam_-_Pacha_Payaru_Payasam_8_1600.jpg,,
348,Garlic Toasted Beans Salad Recipe,"To begin making Garlic Toasted Beans Salad Recipe, cut the ends of the beans, cut them into 1 inch pieces.Now, blanch the beans with enough water with salt for 2 minutes and transfer it into cold water to retain its crunch.Heat olive oil in a pan, add the sliced garlic and roughly torn red chillies and saute till garlic turns golden brown and releases all its flavour into the oil.Drain and add the blanched beans into the pan and give it a good stir.Season with salt, saute for a minute and turn off the heat.
Transfer the Garlic Toasted Beans Salad Recipe into a serving bowl and serve.Serve the Garlic Toasted Beans Salad Recipe, along with Roasted Tomato and Pumpkin Soup and Spaghetti Pomodoro for a complete meal.",green beans,https://www.archanaskitchen.com/images/archanaskitchen/1-Author/nithya.anantham/Garlic_Toasted_Beans_Salad_Recipe.jpg,,
349,Sri Lankan Chicken Curry Recipe - Kukul Mas Curry,"To begin making the Sri Lankan Chicken Curry Recipe - Kukul Mas Curry, thoroughly wash the chicken pieces and set aside.
The first step is to make the Sri Lankan curry powder.
In a small pan; add all the ingredients for the spice powder including coriander seeds, cumin seeds, whole black pepper corns, mustard seeds, cloves, cardamom pods, dalchini, saunf, dry red chillies, cinnamon stick and roast on medium heat for 3 to 4 minutes until you can see the spices crackling and the aromas coming through.Once it is roasted, switch off the heat and let it cool down.
Once it is cooled down, add it in the mixer grinder and make a powder.
Your Srilankan Powder is ready.In a pressure cooker, heat oil on medium flame.
Add ginger, garlic, onions, red chillies and curry leaves.Saute for a good 4-6 minutes, until it turns into a deep brown colour.
To this add the Sri Lankan curry powder, mix well.Add the chicken and 2 cups of water.
Close the lid and pressure cook the Kukul Mas Curry for 2 whistles.
Turn off the heat, allowing the pressure to release naturally.
Once the pressure is release, open the lid, mix in the coconut milk into the Kukul Mas Curry and simmer on low flame for 5 minutes.
Once done, turn off the heat and transfer the Kukul Mas Curry to as serving bowl and serve hot.Serve Sri Lankan Chicken Curry Recipe (Kukul Mas Curry) hot with Dhaba Style Spicy Ghee Rice Recipe Made From Whole Spices or Veechu Parotta Or Ceylon Parotta Recipe and Pickled Onions Recipe for a completely satisfying meal.
","chicken curry, onion, coconut milk",https://www.archanaskitchen.com/images/archanaskitchen/0-Archanas-Kitchen-Recipes/2018/Sri_Lankan_Kulkul_Mas_Curry_Chicken_Curry-3.jpg,,
350,Onion Rava Dosa Recipe - Spiced Semolina Crepe,"To begin making Onion Rava Dosa, in a tadka pan heat a teaspoon of  oil.
Add cumin seeds and let it sizzle.
Turn off the heat and add grated coconut and roast for a few minutes in the existing heat.In a medium bowl add rava, rice flour, all purpose flour, green chillies, peppercorns, chopped onions, torn curry leaves, coriander leaves, roasted cumin and coconut with required salt, stir well.Add the buttermilk little by little and keep stirring until well combined.
The dosa batter should be watery.Allow the rava dosa batter to rest for 15 minutes.
It will thicken a bit in the process, if it does, add just a little more water to make it a runny dosa batter.Preheat a non stick dosa tawa on medium heat.
Sprinkle water on the tawa and if it sizzles it's perfectly hot for making the onion rava dosa.Now pour a ladleful of batter from the border to inside of the tawa, the batter will sizzle and spread on its own.
The Rava Dosa is not spread like a traditional batter but is made to spread on its own.
Hence it's crucial for the batter to be runny.Drizzle some oil around the Onion Rava Dosa and allow the dosa to cook on medium heat until brown and crispy from the bottom.
Onion Rava dosa needs to be cooked on one side, so fold and serve once it's ready.Serve the Onion Rava Dosa along with Coconut Chutney and South Indian Filter Coffee  for a complete meal.
","coconut,  flour,onion, buttermilk, sooji, rice flour",https://www.archanaskitchen.com/images/archanaskitchen/1-Author/Divya_Shivaraman_/Onion_Rava_Dosa.jpg,,
351,Awadhi Style Nargisi Kofta Recipe (Boiled Egg Wrapped With Spiced Potato Recipe),"We begin making the Awadhi Style Nargisi Kofta Recipe (Boiled Egg Wrapped With Spiced Potato Recipe) by heating a saucepan with oil and sauté the vegetables except the potatoes, mentioned in the list for the outer layer.Once the vegetables are cooked, add all the spice powders and give it a toss.
Season it with salt and pepper.
Cover and cook it for 2 more minutes.Add these sautéed vegetables to the boiled potatoes and give it a nice mash using a potato masher and bind all the ingredients into a paste.Take the boiled egg and start wrapping the egg with this potato paste as a coating.
Tightly seal the potato mixture.Coat it with bread crumbs evenly and heat a flat bottomed pan with oil and carefully place these koftas and evenly fry them till it is nice and brown all over.Serve the Awadhi Style Nargisi Kofta (Boiled Egg Wrapped With Spiced Potato) as a party appetizer.","eggs , carrot, onion, potato ,cabbage ",https://www.archanaskitchen.com/images/archanaskitchen/0-Archanas-Kitchen-Recipes/2016/Nov-11/Awadth_Style_Vegetarian_Nargisi_Kofta_Recipe-1-2.jpg,,
352,Tawa Tandoori Roti Recipe,"To begin making the Tawa Tandoori Roti Recipe, we will add all the ingredients into one bowl and add water slowly according to your requirement to knead it into a soft and non-sticky dough.Add little bit of oil at the end and knead it for some more time till the dough becomes completely soft.Rest the dough by covering it with a damp cloth for atleast 10 minutes.Once rested, heat a cast iron tawa pan.
Pinch out a medium sized ball from the dough and flatten it on a floured rolling surface.Roll the dough flat and round, the thickness must be same as the tawa paratha.
Take some water in a bowl and brush it over one side of the rolled dough.Place the watered surface dough on to the tawa and leave it for few seconds until you see some bubbles rising.Leave it on low heat for 2 minutes and with the help of a spatuala, try to carefully take out the roti, it will be little hard as it will get stuck to the pan but be careful enough to remove the roti and do not tear it apart.Flip it over and then cook on the other side as well.
You can also lift the pan completely and flip it over before you remove the roti from the tawa and show it directly over the flame.Cook on the other side also for 2 minutes and you can serve hot.Serve the Tawa Tandoori Roti along with Bihari Karela and Aloo Ki Subzi , Punjabi Dal Tadka and raita to create a meal for your Sunday lunch or everyday lunch.
 ","curd, wheat flour",https://www.archanaskitchen.com/images/archanaskitchen/1-Author/sibyl_sunitha/Tawa_Tandoori_Roti_Recipe_.jpg,,
353,Barnyard Millet Jaggery Payasam Recipe,"To begin making the Barnyard Millet Jaggery Payasam Recipe, we will first pressure cook the barnyard millet in a pressure cooker with 1 cup of water for 5 to 6 whistles.
It takes a good 20 minutes to cook the millet in the pressure cooker.Allow the pressure to release naturally and keep the Barnyard Millet aside.Heat a sauce pan with milk on a medium heat.
Add crushed cardamom pods and jaggery into the milk and bring it to a boil.
Add cooked millet as well and simmer the Barnyard Millet Jaggery Payasam for at least 20 minutes until the payasam thickens and has a creamy consistency.
When you get the desired consistency for the Barnyard Millet Jaggery Payasam, you can turn off the heat.
Heat a small skillet, add 2 tablespoons of ghee.
Drop in the cashew nuts and toast it until it is golden brown on low to medium heat.Once cashew nuts are roasted, spoon it over the Barnyard Millet Jaggery Payasam and serve.Serve the Barnyard Millet Jaggery Payasam Recipe after a wonderful meal of Thalassery Chicken Biriyani and Tomato Onion Cucumber Raita to make your Sunday Lunch special.
","cashew nuts, barnyard millet variety,milk",https://www.archanaskitchen.com/images/archanaskitchen/0-Archanas-Kitchen-Recipes/2018/July-25/Jhangora_ki_Kheer_Barnyard_Millet_Kheer_Recipe-4_1600.jpg,,
